filename,explanation
VASTJ.1.7.png,"This multi-scale network visualization is extremely dense, featuring multiple highly interconnected circular cluster nodes with hundreds of overlapping edges, zoomed-in detail views connected via expanding lens cones, and long chain-like paths between clusters. The data density and image clutter are very high, with edge crossings and overlapping nodes creating dense visual textures especially in the large circular subgraphs. Multiple color encodings (dark, blue, red, orange, yellow), dashed highlight circles, varying node sizes, and the hierarchical zoom structure demand substantial cognitive effort to interpret, contributing to a very high overall visual complexity score."
vis734.png,"This visualization is extraordinarily data-dense, featuring hundreds of country rows against dozens of Olympic year columns, with multiple overlapping color encodings (magenta, cyan, gray) representing different statistical metrics simultaneously. The text legibility is severely challenged by extremely small country name labels and year headers, requiring close inspection to parse. The cognitive load is exceptionally high due to the right-to-left temporal axis, multi-color encoding scheme, variable bar lengths, and the sheer volume of elements—placing this firmly in the highest complexity tier."
VASTC.13.9.png,"This visualization is extraordinarily dense, combining multiple simultaneous encoding systems: small colored matrix thumbnails on the left, a central flow diagram with numerous overlapping colored connection lines (representing 12 POS categories), multiple word clouds of varying sizes in the center, and four enlarged word cloud panels on the right. The text density alone is extreme, with hundreds of individual words rendered at varying sizes, weights, and colors across all panels. Domain-specific knowledge (NLP part-of-speech tagging) is required to interpret the color scheme and relationships, and the multi-panel coordinated layout demands very high cognitive effort to parse the relationships between the left matrices, center flow lines, and right detail views."
InfoVisC.65.5(2).png,"This dense network graph contains hundreds of nodes and highly interwoven edges, creating extreme visual clutter and overlap particularly in the central clusters — driving data density and aesthetics uncertainty scores very high. The structural complexity is substantial, featuring mixed hierarchical tree structures alongside dense cross-connecting arcs that require significant cognitive effort to trace and interpret. Although the visualization is monochromatic with minimal text, the sheer volume of overlapping curved edges and nodes across multiple interconnected clusters demands intense perceptual effort, pushing the overall complexity near the top of the scale."
InfoVisJ.1149.6(1).png,"This is an extremely dense multi-panel text analysis dashboard featuring at least five coordinated views (BASE TEXT, OVERVIEW, PAGE VIEW, LINE VIEW, WORD VIEW), each packed with hundreds of tiny color-coded cells, markers, and annotations. The data density is near-maximum: the OVERVIEW panel alone contains an enormous grid of green, red, yellow, and blue elements with axis labels so small they are barely legible, and the bottom row of the overview is filled with dense red rotated text. The cognitive load is very high, requiring specialized domain knowledge to interpret the coordinated views, multiple encoding channels (color hue, color intensity, cell size, position, annotations A–G), and the relationships between panels at different granularities (page, line, word level)."
