filename,explanation
v488_n7409_12_f4.png,"This visualization combines a phylogenetic tree with a geological timescale, requiring domain-specific knowledge of paleontology and entomology (high domain_schema). The text_annotation is moderately high with numerous geological period labels along the bottom axis, taxon names on the right, and time markers along the top. The visual encoding involves branching tree structures with both solid and dashed lines, shaded temporal gaps (Romer's gap, Hexapoda gap), and an embedded fossil photograph, adding moderate complexity. The color_symbol usage is restrained but purposeful with cyan/blue lines, gray shading bands, and a small red scale bar. The cognitive load is elevated due to the need to cross-reference branching patterns with geological time periods and understand the significance of the gaps and dashed vs. solid lines."
VASTC.13.9.png,"This visualization exhibits high complexity across multiple dimensions. The data density is very high with numerous word clouds, connecting lines/flows, and matrix-like grid elements on the left side. The visual encoding is complex, combining multiple representation types: word clouds with varying font sizes, colored flow/connection lines of varying thickness, small matrix plots, and a categorical legend with 10+ categories. The text annotation is extremely dense with hundreds of words displayed across multiple panels. The domain schema requires understanding of NLP/linguistics concepts (parts of speech, word embeddings). Color and symbol usage is extensive with many distinct colors encoding different word categories. The aesthetic order is cluttered with overlapping flow lines and densely packed text elements, contributing to high cognitive load."
VASTJ.1.7.png,"This visualization features dense network graphs with multiple interconnected clusters shown at different scales via zoom/detail views. The data_density is very high with hundreds of nodes and edges creating visually dense clusters. The visual_encoding is complex, combining node-link diagrams with color encoding (red, orange, yellow gradients), size variation, dashed blue circle annotations, and zoom-in callout panels connecting overview to detail. The domain_schema requires specialized knowledge of network/graph analysis. The aesthetic_order scores high due to overlapping edges within clusters creating visual clutter, though the overall layout has some organization. Minimal text_annotation keeps that dimension low, but the cognitive_load is substantial given the multi-scale representation and dense edge crossings."
visMost573.png,"This visualization is a complex thematic map of Jerusalem showing sound segmentation with multiple overlapping translucent circular elements representing different sound types (police sirens, ambulance sirens, church bells, Mu'athin Adhan, ceremonial sirens). The data_density is high due to numerous overlapping sound zones across the map. The color_symbol dimension is significant with at least 5 distinct color-coded sound types plus 11 combination patterns shown in the legend. The domain_schema requires understanding of geographic/spatial sound mapping concepts. The aesthetic_order scores high due to the dense overlapping of semi-transparent circles creating visual clutter, especially in the Old City area. The extensive legend with both individual sounds and sound combinations, plus the descriptive text, contributes to moderate text_annotation complexity."
vis734.png,"This is an extremely dense infographic showing Olympic medal data per capita across many countries and many Olympic years. The data_density is very high with hundreds of colored bars representing different countries across numerous time periods. The text_annotation is substantial with many country names listed along the left axis and year labels across the top, though much is barely legible at this resolution. The color_symbol dimension uses a distinctive pink/magenta/blue/gray palette to encode different categories, and the aesthetic_order score is high due to the sheer density and visual clutter of overlapping colored segments. The cognitive_load is considerable as interpreting the proportional relationships across countries and time requires significant effort and domain understanding of Olympic history."
VisJ.1541.1(2).png,"This is a finite element mesh or computational simulation visualization with extremely high data density due to thousands of triangular mesh elements filling the entire domain. The domain_schema is high as it requires specialized knowledge of computational physics/engineering (FEM mesh with color-mapped scalar field). The aesthetic_order scores high due to the dense, intricate tessellation pattern that creates visual clutter. However, the visual encoding is relatively simple (single color scale mapping to a scalar value), text_annotation is minimal (just the colorbar labels), and the color_symbol dimension is moderate with a single blue gradient. The cognitive load is moderately high due to the need to interpret mesh density variations and the scalar field distribution around the T-shaped cutout geometry."
InfoVisC.65.5(2).png,"This is a dense directed graph or network visualization with hundreds of nodes and edges, many of which overlap and cross each other extensively. The data_density is very high due to the sheer number of nodes and connections, and the aesthetic_order is poor with significant visual clutter from overlapping edges. The domain_schema score is elevated as this appears to be a hierarchical network requiring specialized knowledge to interpret, and cognitive_load is high because tracing individual paths or understanding the structure is extremely difficult. However, the lack of color, text annotations, and varied visual encodings (monochrome nodes and edges only) moderates the score somewhat compared to the most complex multi-panel dashboards."
InfoVisJ.1149.6(1).png,"This is an extremely dense multi-view visualization system with at least 7 coordinated panels (labeled A through G), including a base text view, overview, page view, line view, and word view. The data density is very high with hundreds of small colored cells/marks across multiple matrix-like displays. The domain schema requires specialized knowledge of text collation/variant analysis, the color encoding uses multiple hues (green, red, blue, orange, yellow) to represent different types of textual variants, and the cognitive load is extremely high due to the need to cross-reference multiple coordinated views simultaneously. The text annotation is also very dense with both the base text panel and numerous axis labels across all views."
