filename,data_density_explanation,visual_encoding_explanation,text_annotation_explanation,domain_schema_explanation,color_symbol_explanation,aesthetic_order_explanation,cognitive_load_explanation,summary,topic_explanation
visMost97.png,Only 5 data points represented by continent shapes with numbers; extremely sparse.,Simple geographic shapes with size roughly proportional to values; straightforward encoding.,"Clear title, subtitle, and 5 labeled values; minimal but readable text.",Simple infographic concept requiring no specialized knowledge.,"Five distinct flat colors (red, blue, green, yellow, light blue) for continents; simple but present.","Very clean, minimal layout with ample whitespace; no clutter.",Immediately understandable at a glance; near-zero cognitive effort required.,A simple infographic showing world population distribution by continent using colored map shapes and large numbers. Extremely clean and minimal design with very low visual complexity.,The color-coded continent shapes are the primary visual element contributing to what little complexity exists. The geographic encoding and text labels are the only other notable features in this otherwise minimal infographic.
VisC.375.9(2).png,Very sparse graph with only 9 nodes and a handful of edges; minimal data content.,Simple node-link diagram with uniform black dots and blue lines; trivial encoding.,"Clear node labels (a1, a5, b1, b9, b10, c1, c3, c9, d1, d2) with ample spacing.","Basic graph/network diagram requiring minimal domain knowledge, though node naming suggests some grouping structure.",Only two visual elements: black dots and blue lines; extremely limited color/symbol variety.,"Very clean, spacious layout with no overlapping elements.",Immediately interpretable; very few elements to process.,A very simple node-link graph with approximately 9 labeled nodes and a few connecting edges. The layout is sparse and clean with minimal visual complexity.,The extremely low data density is the defining characteristic of this visualization's simplicity. The basic graph schema and trivial cognitive load confirm the minimal complexity.
InfoVisJ.1063.13.png,"Dense dendrogram with many leaf nodes and an accompanying heatmap with numerous rows, creating high information density.",Hierarchical clustering dendrogram paired with a binary/sparse heatmap; moderately complex dual encoding.,Very small text labels visible along the heatmap columns but largely illegible at this resolution; minimal readable text.,"Requires understanding of hierarchical clustering dendrograms and heatmaps, a specialized bioinformatics/statistics schema.",Only black and white used throughout; minimal color variety.,The dense branching structure and tightly packed heatmap rows create visual clutter and a sense of disorder.,Tracking hierarchical relationships across many branches and correlating with heatmap patterns demands significant cognitive effort.,"A hierarchical clustering dendrogram paired with a black-and-white heatmap showing many rows/samples. Despite the monochrome palette, the dense branching structure and numerous leaf nodes create substantial visual complexity. The specialized schema and high data density are the primary complexity drivers.",The extremely dense dendrogram with many branches and the accompanying heatmap create high data density. The specialized hierarchical clustering schema requires domain knowledge. Interpreting cluster relationships across many nodes demands significant cognitive effort.
VASTJ.1.7.png,"Dense network clusters with hundreds of edges creating visual clutter, especially in the expanded graph views.","Multiple visual encodings: node-link diagrams at different scales, zoom lenses, color-coded chains, and dashed circle selections.",Virtually no text present in the visualization.,Complex multi-scale network visualization with detail-on-demand zoom panels requiring specialized graph analysis knowledge.,Color gradient from yellow to red encodes a variable along the chain; blue dashed circles mark selections; dark dense edge textures in expanded views.,"Moderately cluttered with overlapping expanded views and dense edge bundles, though the layout has some organization.",Understanding the multi-scale relationship between the central chain and the expanded cluster views requires significant cognitive effort.,"A multi-scale network visualization showing a central color-coded node chain (yellow to red) with detail-on-demand zoom panels revealing dense graph cluster structures. The combination of scales, dense edge networks, and color encoding creates high visual and cognitive complexity.","The specialized multi-scale network schema with zoom lenses is the primary complexity driver, requiring graph analysis expertise. The extreme edge density within expanded clusters creates significant visual clutter. The cognitive load of connecting the overview chain to detailed subgraph views is substantial."
economist_daily_chart_493.png,"Each of 16 German states has multiple data values (GDP, population for two years) plus choropleth encoding, creating substantial data density across the map.",Combines choropleth shading with embedded numerical tables per region and a dashed boundary line; multiple encoding types simultaneously.,"Heavy text load with state names, city names, neighboring country labels, numerical values in small boxes, and a detailed legend.",Thematic choropleth map of Germany with embedded statistics; moderately specialized but geographic maps are generally familiar.,Five-level unemployment color scale plus contrasting blue/red for data tables; dashed boundary line adds visual markers.,The map is well-organized but the many small data boxes create moderate visual clutter across the geographic space.,"Requires cross-referencing choropleth colors with legend, reading small embedded data tables, and understanding temporal comparisons.","A choropleth map of German states showing unemployment rates via color shading, with embedded data tables for GDP and population across two time periods. The combination of geographic encoding, color scale, and dense numerical annotations creates substantial visual complexity.","The enormous amount of text labels and numerical data embedded in each state region dominates the complexity. The high data density from multiple variables per state compounds this, and the cognitive load of integrating choropleth colors with tabular data across 16 regions is demanding."
VASTJ.870.4.png,Moderate data density with 6 rows of stacked/segmented bars showing multiple small segments of varying widths.,Dual-encoding with bar length and color gradient representing student numbers; requires understanding the legend mapping.,Row labels with comma-separated number sequences and a legend at top; moderate text volume.,Specialized educational visualization showing question ordering permutations and student distributions; requires domain context.,Orange-to-green color gradient encoding student counts with dashed borders distinguishing sections.,"Relatively clean layout with clear row separation, though small bar segments on the right side add some visual noise.",Understanding the relationship between question orderings and the dual color-coded bar segments requires moderate cognitive effort.,A horizontal bar chart showing different question orderings with dual color-coded segments (orange and green gradients) representing student distributions. Moderate complexity due to the specialized schema and dual encoding requiring legend reference.,"The specialized schema of question permutations and student distributions is the primary complexity driver. The cognitive load of mapping dual color gradients to student counts adds interpretive effort, and the visual encoding with graduated colors across two sections requires careful legend reference."
visMost573.png,"Dense overlapping concentric circles cover the entire map, creating significant visual clutter especially in the eastern portion.",Concentric ring glyphs encode sound types and combinations via color and pattern; moderately complex spatial encoding on a geographic base.,"Extensive legend with 16 entries, descriptive paragraph text, street labels, and landmark annotations create substantial text volume.",A specialized sound-mapping visualization over a geographic map requires understanding of overlapping radial glyphs representing audio phenomena.,"Multiple translucent colors (blue, orange, green, pink) in concentric rings with numerous combinations; rich and varied color palette.","Heavy overlap of translucent circular elements creates visual density, though the overall design is aesthetically intentional.","Interpreting overlapping sound zones, distinguishing color combinations, and reading the detailed legend demands significant cognitive effort.","A sophisticated sound segmentation map of Jerusalem showing overlapping concentric ring glyphs representing different religious and municipal sounds. The dense layering of translucent colored circles over the city map, combined with an extensive legend of sound types and combinations, creates high visual and cognitive complexity.","The rich variety of translucent colored concentric rings and their combinations is the primary complexity driver. The dense overlapping of these glyphs across the map creates substantial clutter, and distinguishing individual sound sources amid the layered transparency demands high cognitive effort."
InfoVisJ.522.15.png,Eight panels showing dense matrix heatmaps and zoomed snippets with substantial pixel-level data content.,"Multiple matrix visualizations at different zoom levels with annotations (circles, arrows) requiring cross-referencing between panels.","Minimal text — section headers, panel labels (A-D), and small citation text; relatively low text volume.",Hi-C contact matrices from genomics require specialized domain knowledge to interpret diagonal patterns and interaction frequencies.,Grayscale and red-orange heatmap colormaps used across panels with red circle annotations and arrows.,Multi-panel layout is organized but the dense matrix textures and varied zoom levels create moderate visual disorder.,"Requires understanding genomic contact matrices, cross-referencing zoom levels, and interpreting subtle pattern differences across 8 panels.","A multi-panel figure showing Hi-C genomic contact matrices at different resolutions and zoom levels, with annotated snippets highlighting specific features. The specialized domain schema and need to cross-reference across panels drives high cognitive load.",The genomics Hi-C contact matrix schema requires specialized knowledge and is the primary complexity driver. Cross-referencing 8 panels at different zoom levels demands high cognitive load. The dense pixel-level matrix data across all panels contributes substantial information density.
VASTC.41.5.png,"Four panels each densely filled with overlapping colored stripes, black shapes, and visual noise creating very high clutter.","Highly abstract encoding with striped patterns, black silhouettes, and layered colored bands that are difficult to interpret.","Minimal text present — only panel labels (a, b, c, d) in yellow circles.",Highly specialized abstract visualization requiring domain expertise to understand what the striped patterns and black shapes represent.,"Rich variety of colors (red, orange, green, pink, black, beige, olive) with complex striped textures across panels.","Visually chaotic and disordered appearance with overlapping elements, glitch-like artifacts, and dense layering.",Extremely difficult to interpret without context; the abstract nature and visual chaos demand high cognitive effort.,"A four-panel visualization with highly abstract, glitch-like visual patterns featuring dense colored stripes and black silhouette shapes. The panels appear to show progressive transformations or different views of the same data, but the encoding is extremely abstract and visually chaotic, making interpretation very challenging without domain knowledge.","The specialized abstract schema is the primary driver of complexity, as it's nearly impossible to interpret without domain context. The chaotic, glitch-like aesthetics create high visual disorder, and the resulting cognitive load is substantial since the viewer must decipher unfamiliar encodings across four dense panels."
VisJ.1949.11.png,Extremely sparse — just a couple of colored trajectory lines on a black background with vast empty space.,"Color-mapped trajectory curves suggest a continuous variable encoding along the path, but without axes or legend the encoding is ambiguous.","No text, labels, axes, legends, or annotations whatsoever.",Appears to be a scientific trajectory or phase-space plot requiring domain knowledge to interpret.,Rainbow-like color gradient along the trajectory from red/yellow through cyan/teal adds some encoding richness.,Very clean and minimal; no clutter or overlap; mostly empty black space.,"Without context, labels, or legend, the meaning is opaque, but the visual itself is simple to perceive.",A minimalist visualization showing one or two color-mapped trajectory curves on a black background with no text or annotations. The sparse content keeps visual complexity very low despite some interpretive ambiguity from the lack of context.,Schema is most relevant because the trajectory requires domain knowledge to interpret. Cognitive load is elevated by the complete absence of labels or legend. The color gradient along the trajectory is the primary visual encoding and the most notable detail in an otherwise sparse image.
wsj124.png,Very few data points (7 dots across 4 studies); minimal clutter.,Simple dot plot on a single axis with two symbol types; straightforward encoding.,"Moderate text with a descriptive title, subtitle, study labels, legend, axis labels, and source attribution.",Simple comparative dot plot requiring no specialized knowledge to interpret.,Only two symbol types (filled black and open white circles) with light blue row shading; minimal color variety.,"Very clean, well-organized layout with ample spacing; professional Wall Street Journal design.",Immediately interpretable; the trend of earlier puberty onset is clear at a glance.,"A clean, simple dot plot from the Wall Street Journal comparing puberty onset ages across four studies. Very low visual complexity with only 7 data points, two symbol types, and a well-organized layout.","The text volume (title, subtitle, labels, source) is the most notable complexity element in an otherwise minimal chart. The simple dot encoding and very sparse data density confirm the low overall complexity."
VisJ.1197.5(3).png,Extremely dense 3D treemap or city-block visualization with hundreds of overlapping rectangular elements filling the entire frame.,"3D perspective projection of rectangular blocks encoding data through height and area, creating complex occlusion patterns.","No text, labels, axes, or annotations visible anywhere in the image.",Appears to be a 3D treemap or urban visualization requiring understanding of spatial data encoding in three dimensions.,Monochromatic grayscale palette with shading providing depth cues; no color variety or symbols.,Extremely cluttered with hundreds of overlapping 3D blocks; very difficult to parse individual elements.,"High cognitive demand due to dense 3D occlusion, lack of labels, and difficulty distinguishing individual data elements.","A dense 3D block visualization (likely a 3D treemap or urban model) rendered in grayscale with hundreds of rectangular blocks of varying heights. The extreme density, 3D occlusion, and lack of any labels or legend make interpretation very challenging.","The sheer density of hundreds of overlapping 3D blocks is the primary complexity driver. The visual clutter from occlusion and overlapping elements makes the layout appear chaotic, and the lack of any textual guidance combined with the 3D perspective demands significant cognitive effort to interpret."
SciVisJ.980.7(2).png,Multiple concentric rings with numerous colored glyphs at each radial position create moderate-to-high data density.,"Complex multi-layered encoding: color hue maps to angular position, shape morphs from circles to elongated ellipses to star-like glyphs across radial layers.","Minimal text: only four angular labels (γ values) and one radial label (r=½), so text volume is low.",Highly specialized polar coordinate visualization showing parameterized glyph transformations; requires mathematical/domain knowledge to interpret γ and r parameters.,"Full color wheel spectrum with ~16 distinct hues, plus shape variation across 3 concentric layers including patterned star glyphs at center.","Well-organized circular layout with clear radial symmetry, though the inner glyphs are complex and somewhat cluttered.","Requires understanding polar parameterization, glyph shape encoding, and color-angle mapping simultaneously; high cognitive demand.","A polar coordinate diagram showing parameterized glyphs across concentric rings, with color hue encoding angular position and shape transforming from circles to elongated forms to complex star-like patterns. The specialized mathematical schema and multi-dimensional encoding make this moderately to highly complex.","The specialized polar parameterization schema is the primary complexity driver, requiring domain-specific knowledge. The rich color spectrum and diverse glyph shapes across layers add substantial visual complexity. Together these demand high cognitive effort to decode the relationships between parameters."
InfoVisC.157.1.png,36 individual scatterplot panels (lower triangle of 9x9 matrix) each containing dense point clouds with thousands of data points.,"Uniform scatterplot encoding across all panels with consistent mark types, but the matrix structure requires cross-referencing rows and columns.",Only variable names along the diagonal; minimal text content overall.,SPLOM (scatterplot matrix) is a specialized multivariate visualization requiring understanding of pairwise variable relationships.,Monochrome black points on beige background; virtually no color variety.,"Many dense panels create moderate visual clutter, though the regular grid layout provides structure.",Interpreting pairwise relationships across 36 panels and 9 variables demands significant cognitive effort.,"A scatterplot matrix (SPLOM) showing pairwise relationships among 9 variables (sex, length, diameter, height, whole_wt, shucked_wt, viscera_wt, shell_wt, rings). The dense point clouds across 36 panels create substantial data density despite the monochrome encoding. The systematic matrix layout is structured but cognitively demanding to fully interpret.",The high data density from thousands of points across 36 panels is the primary complexity driver. The cognitive load of comparing pairwise relationships across 9 variables is substantial. The SPLOM schema requires familiarity with multivariate visualization conventions.
InfoVisJ.669.4.png,"Hundreds of data points with significant overlap especially in the lower-right region, creating moderate-to-high density.",Simple scatterplot with single point type; straightforward positional encoding only.,"Minimal text: just a title 'No', y-axis label, and a few tick marks; x-axis labels are missing.",Standard 2D scatterplot requiring no specialized knowledge to interpret.,Monochrome gray/black circles only; no color variety or symbol diversity.,"Dense clustering and overplotting in the lower-right creates visual clutter, though the overall layout is clean.","Easy to grasp the general pattern quickly, though overplotting obscures exact distributions in dense regions.","A monochrome scatterplot with several hundred points showing median value on the y-axis. The main complexity driver is the high data density with substantial overplotting in the lower-right region, but the chart type itself is simple and immediately interpretable.","The heavy overplotting in the lower-right region is the primary complexity driver, making data density the most relevant topic. The resulting visual clutter (aesthetics uncertainty) and difficulty discerning individual points in dense areas (cognitive load) are secondary contributors."
VASTJ.1720.4.png,Only 7 bars with minimal data; very sparse visualization.,Simple bar chart with straightforward height encoding; trivially easy to read.,"Minimal text: a title, axis labels, and numeric values on x-axis; all clearly legible.",Standard histogram/bar chart requiring no specialized knowledge.,Two colors only (dark blue and red highlight); minimal color complexity.,Extremely clean layout with ample whitespace and no clutter.,Instantly interpretable; one highlighted bar draws attention with near-zero cognitive effort.,A simple bar chart showing 7 categories of clothes data with one red-highlighted bar. Extremely low visual complexity with clean layout and minimal encoding.,"The very low data density is the defining feature of this simple chart. Cognitive load is minimal due to the straightforward bar encoding, and the visual encoding is as basic as possible with simple rectangular bars."
wsj28.png,About 12 labeled segments in a single stacked bar with moderate data density.,Simple proportional bar chart with segments; straightforward encoding but many labeled parts.,"Heavy text annotations with dollar amounts, descriptions, and a detailed subtitle; high text volume throughout.",Standard proportional bar chart requiring no specialized knowledge beyond basic fiscal literacy.,Limited color palette of pinks/reds with minimal variation; simple visual design.,"Moderately cluttered due to many text labels crowding the bar segments, but overall organized.",Requires reading many labels and connecting them to segments; moderate cognitive effort.,A Wall Street Journal infographic showing a segmented horizontal bar chart of proposed tax code changes with dollar amounts. The visual encoding is simple but the heavy text labeling across 12 segments adds moderate complexity.,"The dominant complexity driver is the sheer volume of text labels and annotations crowding the chart. The 12 individually labeled segments create moderate data density, and connecting each label to its segment requires non-trivial cognitive effort."
InfoVisJ.2639.8.png,"Three panels with moderate data: a color strip, a text table, and a horizontal bar chart with 8 categories.","Mixed encodings across panels — color strips, tabular text, and bar lengths — but each is individually straightforward.",Substantial text in the table describing each category's actions; high text volume across the visualization.,The visualization describes UI interaction categories; moderately specialized but conceptually accessible.,Multiple distinct colors used consistently across the strip and bar chart; moderate color variety.,Well-organized three-panel layout with clear spatial separation; relatively clean.,Requires reading the table and cross-referencing with the bar chart and color strip; moderate cognitive effort.,"A three-part figure showing (a) a colored timeline strip, (b) a table of interaction categories with descriptions, and (c) a horizontal bar chart with percentages. Moderate complexity driven primarily by the text-heavy table and multi-panel coordination.","The heavy text in the table is the most visually prominent complexity driver. The three coordinated panels contribute moderate data density, and cross-referencing between panels increases cognitive load."
InfoVisJ.691.6(3).png,Moderate number of words displayed with some overlap and cropping at edges.,Simple word cloud encoding: font size maps to frequency/importance; straightforward visual form.,High volume of text words densely packed; the visualization is entirely text-based.,"Word clouds are a familiar, low-abstraction visualization type requiring minimal domain knowledge.","Limited palette of dark navy, medium blue-gray, and light sage green; minimal color variety.","Some visual clutter from overlapping and cropped words, but overall layout is recognizable.","Word clouds are immediately interpretable; larger words are more important, requiring low cognitive effort.","A word cloud visualization showing technical/academic terms with font size encoding importance. Uses a limited color palette of navy, blue-gray, and green tones. Moderate density but a familiar, easily interpretable format.","The visualization is entirely text-based, making text volume the dominant feature. The moderate density of overlapping words contributes to clutter. Despite the text density, the word cloud format is immediately recognizable, keeping cognitive load relatively low."
