filename,data_density_explanation,visual_encoding_explanation,text_annotation_explanation,domain_schema_explanation,color_symbol_explanation,aesthetic_order_explanation,cognitive_load_explanation,summary,topic_explanation
InfoVisJ.2556.8.png,Extremely dense overlapping text labels covering the entire image with minimal whitespace.,"Street names are encoded as text along their paths, creating a typographic map that requires spatial reasoning to parse.","Massive volume of text; street names overlap, rotate at various angles, and repeat, making the image predominantly text.",A typographic street map is a moderately specialized visualization form but conceptually familiar as a map.,Minimal color use — only black and red text on white background; very limited palette.,"Heavy visual clutter from overlapping and intersecting text labels at multiple orientations creates a dense, chaotic feel.",Requires significant effort to trace streets and understand spatial relationships through text alone.,"A typographic street map where road names replace traditional line geometry, creating dense overlapping text at various angles. The image is visually cluttered with high text density but uses minimal color (black and red only). Parsing spatial relationships requires considerable cognitive effort.","The visualization is almost entirely composed of dense, overlapping text labels, making text volume the dominant complexity factor. The resulting image clutter from intersecting street names at multiple angles creates high visual density, and the chaotic overlapping layout drives aesthetic uncertainty."
whoJ44.png,Only two line series over 11 time points; very sparse data content.,Simple dual-line chart with clear differentiation between the two series.,"Title, subtitle, axis labels, legend, annotations, and source citation provide moderate text volume.",Standard time-series line chart requiring no specialized knowledge.,Two colors (dark blue and light blue) with no additional symbols or textures.,"Very clean, well-organized layout with ample whitespace and no clutter.",Instantly interpretable; the message is even stated in the title.,"A clean dual-line time series chart showing Total ODA versus General Budget Support from 2000-2010. Minimal complexity with only two series, clear labels, and a descriptive title that explains the takeaway.","The text volume (title, annotations, labels) is the most notable complexity element in an otherwise very simple chart. The low data density and immediate interpretability confirm the overall low complexity."
VASTC.51.10.png,"Dense temporal visualization with many overlapping text labels, flow lines, and background stream elements creating significant clutter.","Complex encoding combining streamgraph background, branching tree/flow structures, text labels of varying sizes, and temporal axis with multiple visual layers.","Abundant text labels scattered throughout at various sizes; many overlap with background elements and flow lines, reducing legibility.",Specialized topic evolution/keyword flow visualization over time requiring understanding of text mining and temporal topic modeling concepts.,"Muted color palette with gray streams, colored flow lines (red, blue, black), and varying text sizes encoding importance.","Overlapping labels, intersecting flow lines, and layered background streams create considerable visual disorder.","Requires tracking keyword flows across time, understanding branching patterns, and interpreting multiple simultaneous layers of information.","A temporal topic evolution visualization showing keyword flows and branching patterns over several weeks, likely related to an Ebola outbreak. Multiple encoding layers including streamgraphs, flow trees, and text labels create high visual complexity. The specialized schema and dense overlapping elements demand significant cognitive effort.","The high cognitive load from interpreting multiple layered encodings simultaneously is the primary complexity driver. The specialized topic-flow schema requires domain knowledge of text analysis visualization. Dense overlapping text labels, flow lines, and background streams contribute substantial clutter."
SciVisJ.796.18.png,Moderate spatial data density with continuous field visualization but relatively sparse overall with large uniform regions.,Sequential color map on a 2D spatial field with clear contour bands; straightforward but requires understanding of field plots.,Minimal text; only the legend with numeric range labels is present.,"A computational fluid dynamics or stress/thermal contour plot around a circular obstacle, requiring some engineering domain knowledge.",Sequential green-yellow colormap with about 10 discrete bins; moderate color range usage.,Clean layout with smooth contour bands and clear spatial organization; low visual clutter.,"Requires understanding of contour/field plots and the physical domain, but the single-view format keeps cognitive load moderate.","A contour/field plot showing a scalar quantity (likely stress, velocity, or temperature) around a circular obstacle. The visualization uses a sequential colormap with discrete bins and is relatively clean with moderate domain-specific complexity.","The specialized engineering/scientific domain knowledge required to interpret a contour field plot is the primary complexity driver. The continuous field encoding with discrete color bins adds moderate encoding complexity, and the sequential colormap choice is central to reading the data."
v483_n7390_1_f2.png,Three stacked spectra with noisy line traces; moderate data density but clearly separated vertically.,Standard spectral line plots stacked vertically with reference dashed lines; straightforward encoding.,"Minimal text with axis labels, annotations for surface/bulk resonance, and roman numeral labels; all legible.",Spectroscopy plot requiring domain knowledge of surface vs bulk plasmon resonances and energy loss spectra.,Almost entirely monochrome with only red dashed reference lines; very limited color palette.,Clean stacked layout with good separation between traces; low visual clutter.,Requires understanding of spectroscopy and comparing peak positions across three spectra; moderate cognitive demand.,"A stacked spectroscopy plot showing three energy loss spectra with annotated surface and bulk resonance peaks. The layout is clean and well-organized, but domain-specific knowledge is needed for full interpretation.","The specialized spectroscopy schema is the primary complexity driver, requiring domain expertise to interpret resonance peaks. Comparing features across three noisy spectra adds cognitive load, and the noisy line traces contribute moderate data density."
InfoVisC.8.7.png,"Dense overlapping concentric circles, radial lines, and multiple stellar trajectory curves create substantial visual clutter.",Polar projection with multiple overlapping circular and curved paths using different line styles and colors; complex encoding scheme.,"Star names, degree markings around the perimeter, cardinal directions, and epoch/azimuth data in the legend provide moderate text density.",Stereographic or polar projection of stellar altitudes requires specialized astronomical knowledge to interpret correctly.,"Uses red, blue, orange, green, and black lines with solid, dashed, and dotted styles to encode different elements.","Many overlapping curves and grid lines create visual congestion, especially near the center and southern portion.","Requires understanding polar projections, stellar coordinates, azimuth/altitude systems, and epoch-specific astronomical context.","A polar stereographic projection showing stellar altitudes at latitude 48.5 for epoch -4700. Multiple concentric rings, radial gridlines, and colored trajectory curves overlap extensively, requiring specialized astronomical knowledge to decode. The combination of domain-specific schema and dense overlapping elements makes this highly complex.","The specialized astronomical polar projection schema is the primary complexity driver, requiring domain expertise. High cognitive load stems from interpreting overlapping stellar paths in this coordinate system. Dense overlapping gridlines and trajectory curves add significant visual clutter."
VisC.433.1.png,"Dense continuous heatmap with high information content across the entire plotting area, showing complex spectral patterns.",Single heatmap encoding with a continuous color scale; straightforward but the continuous nature adds perceptual complexity.,"Minimal text: axis labels (State, Frequency), state letters A-J, and colorbar label; very low text volume.",Spectral/frequency analysis heatmap requiring some domain knowledge of power spectra and logarithmic scales.,"Rich continuous color palette spanning dark blue through cyan, green, yellow, red to dark red; high color variety.",The dense color gradients and complex patterns create moderate visual clutter despite a single-panel layout.,Interpreting spectral patterns across states requires careful reading of color gradients and understanding of the domain.,A spectral heatmap showing logarithmic power across frequency and states (A-J) with a rich continuous color scale. The dense color patterns and spectral domain context create moderate-to-high visual complexity despite being a single-panel visualization.,"The continuous heatmap packs dense spectral information into every pixel, making data density the primary complexity driver. The rich multi-hue color scale spanning the full spectrum adds significant visual complexity. Together these demand considerable cognitive effort to parse patterns across states and frequencies."
SciVisJ.259.7.png,"Moderate density with a spatial heatmap, contour lines, and an inset zoom panel adding layered information.",Color-mapped continuous field with contour overlays and annotation circles; multiple encoding types present.,"Minimal text — just a title, legend labels, and distance scale; low text volume.",Geospatial/meteorological visualization requiring domain knowledge to interpret primary banners and distance fields.,"Sequential color scale from dark blue through green to yellow, with pink/purple contour lines and red annotation circles.","Moderately cluttered with overlapping contour lines and annotation circles, but the dark background keeps it manageable.","Requires understanding of the spatial distance field, contour meanings, and the zoom inset relationship.","A geospatial visualization showing distance fields with a sequential colormap, contour lines, and a magnified inset view. The domain-specific nature and layered encodings create moderate-to-high complexity despite relatively clean aesthetics.","The specialized geospatial/meteorological schema is the primary complexity driver, requiring domain knowledge to interpret. The layered color encoding with contour overlays adds visual detail, and the cognitive load of relating the inset zoom to the main view increases interpretive effort."
